PMID,Title,Journal,PubDate,Authors,Abstract,PubMedURL
33028796,Influence of zirconia surface treatments of a bilayer restorative assembly on the fatigue performance.,Journal of prosthodontic research,2021,"Machado PS, Pereira GKR, Zucuni CP, Guilardi LF, Valandro LF, Rippe MP","This study evaluated the influence of different surface treatments of zirconia used to enhance bonding with veneering porcelain, and thermocycling on the resistance to porcelain cracking and delamination during fatigue test.
Bilayer ceramic discs were made from zirconia blocks (IPS e.max Zircad MO, Ivoclar Vivadent - 0.7 mm thickness) and randomized into 8 groups (n= 15) according to two factors: 'zirconia surface treatment' (Control; Grinding - diamond bur; Air-abrasion - aluminum oxide particles; and Liner - application of a ceramic liner [IPS e.max Zirliner, Ivoclar Vivadent]); and 'thermocycling' (presence - 12,000 thermal cycles; 5-55ºC; or absence). The discs were veneered with porcelain (IPS e.max Ceram, Ivoclar Vivadent - 0.7 mm; totaling 1.4 mm thickness) according to ISO 6872:2015 for biaxial flexure strength testing. Fatigue tests (step-stress approach; 20 to 100 MPa; step of 10 MPa; 10,000 cycles per step; 10 Hz frequency) were run, followed by the data analysis (Kaplan-Meier and Mantel-Cox post-hoc tests). Analysis of roughness, topography, crystallographic phase arranges and fractography were also executed.
The surface treatment and thermocycling did not influence the porcelain crack nor delamination resistance. When only comparing the surface treatments for crack resistance outcome, the liner application depicted the worst fatigue performance in comparison to grinding and air-abrasion, while all groups were similar for delamination.
Neither the surface treatment of the zirconia nor the thermocycling influences the porcelain crack resistance or the resistance to delamination of the bilayer porcelain-veneered zirconia specimens.",https://pubmed.ncbi.nlm.nih.gov/33028796/
32941094,Influence of Surface Conditioning on the Repair Strength of Bioactive Restorative Material.,Journal of applied biomaterials & functional materials,2020,"Awad MM, Almutairi N, Alhalabi F, Robaian A, Vohra FA, Ozcan M, Maawadh A, Alrahlah A","To evaluate the effects of surface treatment and repair material on the repair shear bond strength (SBS) of the bioactive restorative material.
A total of 240 Activa BioActive Restorative (Activa) discs were prepared, aged, and polished, and divided randomly into eight groups (
Surface treatment with air abrasion significantly improved the SBS for repair using both Activa and Bulk-RBC. Repair SBS using Activa was significantly higher compared with Bulk-RBC. Cohesive failure in substrate and mixed failures were most common in the surface-treated groups (2-4, 6-8). Air abrasion produced prominent surface topography changes compared with polishing.
Air abrasion enhances the repair SBS of aged bioactive restorative material. The use of the same material (Activa) for repair affords a higher bond strength compared with the use bulk-RBC.",https://pubmed.ncbi.nlm.nih.gov/32941094/
32926155,Airborne-particle Abrasion and Dentin Bonding: Systematic Review and Meta-analysis.,Operative dentistry,2021,"Lima VP, Soares K, Caldeira VS, Faria-E-Silva AL, Loomans B, Moraes RR","The literature reviewed suggests that airborne particle abrasion has no negative effects on the bond strength of resin-based materials to dentin and that a positive influence on dentin bond strength was only achieved in specific air-abrasion conditions.
In this systematic review the authors investigated how airborne-particle abrasion (APA) using aluminum oxide affects the bond strength of resin-based materials to dentin. The search was performed in three databases. In vitro studies (Type of study) comparing the bond strength of resin-based materials (Outcome) to air-abraded (Intervention) compared with non-air-abraded (Comparison) human dentin (Population) were included (the PICOT elements are given parenthetically). From 5437 unique articles, 65 were read in full, 33 were included in the qualitative synthesis, and 32 were included in the meta-analysis. Methodologic quality and risk of bias were assessed. Comparisons were performed between air-abraded and control dentin groups by adopting a random-effects model (α=0.05). Additional analyses were carried out for the different parameters used in APA: type of surface treatment in the control group, particle size, air pressure, and APA duration. The bond strength to air-abraded dentin was favored only when the control surface was treated with a hand excavator. For particle size, APA was favored when the particle size was >30 μm and the controls were no treatment or hand excavator or when the particle size was ≤30 μm and the control was bur. In addition, the results favored air-abraded groups only when the pressure was > 5 bar and bur was used in the control group. No significant differences were observed for duration of APA. No comparison on bond strength considering the presence of aging conditions was possible in the included studies due to the low number of studies that aged the specimens. In conclusion, APA had no negative effects on the bond strength of resin-based materials to dentin and was able to improve the dentin bond strength only when the particle size was > 30 μm and air pressure was > 5 bar. PROSPERO registration protocol: CRD42018096128.",https://pubmed.ncbi.nlm.nih.gov/32926155/
31471241,In vitro comparison of shear bond strengths of ceramic orthodontic brackets with ceramic crowns using an aluminium oxide air abrasion etchant.,International orthodontics,2020,"Oldham CC, Ballard RW, Yu Q, Kee EL, Xu X, Armbruster PC","The aim of this study was to determine if there are differences between the shear bond strengths of 3 types of ceramic brackets when bonded to different ceramic substrates using an aluminium oxide air abrasion etchant protocol.
Substrate groups consisting of thirty-six lithium disilicate (e.max® CAD) samples and thirty-six lithium silicate infused with zirconia (CELTRA® DUO) samples were fabricated to replicate the facial surface of a left maxillary central incisor. The surface of all samples was prepared with an aluminium oxide air abrasion etchant protocol. Each substrate group was split into three test groups (n=12). Each test group was bonded using a different brand of ceramic orthodontic bracket. Shear bond strength (SBS) testing was conducted and the mean SBS values for each group were calculated and recorded in MPa. An Adhesive Resin Index (ARI) score was also assigned to each sample to assess the location of bond failure.
Mean SBS of the e.max® CAD groups were significantly less than the CELTRA® DUO groups. Symetri brackets showed significantly higher shear bond strengths to both substrates than both of the other brackets tested. ARI scores of the e.max® CAD groups were significantly less than the CELTRA® DUO groups.
The Symetri bracket was the only bracket that was effective for both substrates (mean SBS>6mPa). The Etch Master protocol does not appear effective for e.max® CAD.",https://pubmed.ncbi.nlm.nih.gov/31471241/
