PMID,Title,Journal,PubDate,Authors,Abstract,PubMedURL
28078617,Changes in the first postoperative night bispectral index of patients after thyroidectomy with different types of primary anesthetic management: a randomized controlled trial.,Journal of clinical monitoring and computing,2018,"Tan WF, Wang ZL, Ma H, Jin F, Lu HW","Despite major advances in anesthesia management and developments in anesthetic agents, postoperative sleep disturbances remain dissatisfactory for many patients. We hypothesized that propofol might have a subtle influence on sleep after thyroidectomy compared to sevoflurane. A randomized, single-blinded, controlled trial was conducted at the First Hospital of China Medical University from October 2014 to October 2015. One hundred and twenty-four patients undergoing thyroidectomy were enrolled and received sevoflurane (sevoflurane group) or propofol (propofol group) as anesthesia maintenance. Major assessments were made during the operation (different types of anesthetic management) and on the first postoperative night (sleep status). The primary outcome was postoperative sleep status, measured by the BIS-Vista monitor on the first night after surgery between propofol and sevoflurane groups. A total of 105 patients (79 women, 26 men; mean age 49 years; range 18-65 years) were included in the final study sample. All patients in both groups showed one of the five sleep patterns classified by this trial. The BIS-area under the curve was decreased, the sleep efficiency index was significantly increased, and the durations of postoperative sleep and sleep stage N3 were increased by 110.5 and 36.5 min per patient, respectively, in the propofol compared to the sevoflurane group. Propofol might preserve sleep time immediately after thyroidectomy. Clinical Trials.gov identifier: NCT 02146976.",https://pubmed.ncbi.nlm.nih.gov/28078617/
28027085,Bispectral Index Can Reliably Detect Deep Sedation in Mechanically Ventilated Patients: A Prospective Multicenter Validation Study.,Anesthesia and analgesia,2017,"Wang ZH, Chen H, Yang YL, Shi ZH, Guo QH, Li YW, Sun LP, Qiao W, Zhou GH, Yu RG, Yin K, He X, Xu M, Brochard LJ, Zhou JX","Excessively deep sedation is prevalent in mechanically ventilated patients and often considered suboptimal. We hypothesized that the bispectral index (BIS), a quantified electroencephalogram instrument, would accurately detect deep levels of sedation.
We prospectively enrolled 90 critically ill mechanically ventilated patients who were receiving sedation. The BIS was monitored for 24 hours and compared with the Richmond Agitation Sedation Scale (RASS) evaluated every 4 hours. Deep sedation was defined as a RASS of -3 to -5. Threshold values of baseline BIS (the lowest value before RASS assessment) and stimulated BIS (the highest value after standardized assessment) for detecting deep sedation were determined in a training set (45 patients, 262 RASS assessments). Diagnostic accuracy was then analyzed in a validation set (45 patients, 264 RASS assessments).
Deep sedation was only prescribed in 6 (6.7%) patients, but 76 patients (84.4%) had at least 1 episode of deep sedation. Thresholds for detecting deep sedation of 50 for baseline and 80 for stimulated BIS were identified, with respective areas under the receiver-operating characteristic curve of 0.771 (95% confidence interval, 0.714-0.828) and 0.805 (0.752-0.857). The sensitivity and specificity of baseline BIS were 94.0% and 66.5% and of stimulated BIS were 91.0% and 66.5%. When baseline and stimulated BIS were combined, the sensitivity, specificity, and clinical utility index were 85.0% (76.1%-91.1%), 85.9% (79.5%-90.7%), and 66.9% (57.8%-76.0%), respectively.
Combining baseline and stimulated BIS may help detect deep sedation in mechanically ventilated patients.",https://pubmed.ncbi.nlm.nih.gov/28027085/
28017174,Benefit of general anesthesia monitored by bispectral index compared with monitoring guided only by clinical parameters. Systematic review and meta-analysis.,Brazilian journal of anesthesiology (Elsevier),2017,"Oliveira CR, Bernardo WM, Nunes VM","The bispectral index parameter is used to guide the titration of general anesthesia; however, many studies have shown conflicting results regarding the benefits of bispectral index monitoring. The objective of this systematic review with meta-analysis is to evaluate the clinical impact of monitoring with the bispectral index parameter.
The search for evidence in scientific information sources was conducted during December 2013 to January 2015, the following primary databases: Medline/PubMed, LILACS, Cochrane, CINAHL, Ovid, SCOPUS and TESES. The criteria for inclusion in the study were randomized controlled trials, comparing general anesthesia monitored, with bispectral index parameter with anesthesia guided solely by clinical parameters, and patients aged over 18 years. The criteria for exclusion were studies involving anesthesia or sedation for diagnostic procedures, and intraoperative wake-up test for surgery of the spine.
The use of monitoring with the bispectral index has shown benefits reducing time to extubation, orientation in time and place, and discharge from both the operating room and post anesthetic care unit. The risk of nausea and vomiting after surgery was reduced by 12% in patients monitored with bispectral index. Occurred a reduction of 3% in the risk of cognitive impairment postoperatively at 3 months postoperatively and 6% reduction in the risk of postoperative delirium in patients monitored with bispectral index. Furthermore, the risk of intraoperative memory has been reduced by 1%.
Clinically, anesthesia monitoring with the BIS can be justified because it allows advantages from reducing the recovery time after waking, mainly by reducing the administration of general anesthetics as well as the risk of adverse events.",https://pubmed.ncbi.nlm.nih.gov/28017174/
27851693,The Correlation Between Recordable MEPs and Motor Function During Spinal Surgery for Resection of Thoracic Spinal Cord Tumor.,Journal of neurosurgical anesthesiology,2018,"Guo L, Li Y, Han R, Gelb AW","Motor evoked potentials (MEPs) are commonly used during surgery for spinal cord tumor resection. However, it can be difficult to record reliable MEPs from the muscles of the lower extremities during surgery in patients with preoperative weakness due to spinal cord compression. In this study, motor function of patients' lower extremities and their association with intraoperative MEP recording were compared.
Patients undergoing thoracic spinal cord tumor resection were studied. Patients' motor function was checked immediately before the surgical procedure. MEP responses were recorded from the tibialis anterior and foot muscles, and the hand muscles were used as control. Electrical current with train of eight pulses, 200 to 500 V was delivered through 2 corkscrews placed at C3' and C4' sites. Anesthesia was maintained by total intravenous anesthesia using a combination of propofol and remifentanil after induction with intravenous propofol, remifentanil, and rocuronium. Rocuronium was not repeated. Bispectral Index was maintained between 40 to 50.
From 178 lower limbs of 89 patients, myogenic MEPs could be recorded from 100% (105/105) of the patients with 5 of 5 motor strength in lower extremity; 90% (36/40) from the patients with 4/5 motor strength; only 25% (5/20) with 3/5; and 12.5% (1/8) with 2/5 motor strength; none (0/5) were able to be recorded if the motor strength was 1/5.
The ability to record myogenic MEPs is closely associated with the patient's motor function. They are difficult to obtain if motor function is 3/5 motor strength in the lower extremity. They are almost impossible to record if motor function is worse than 3/5.",https://pubmed.ncbi.nlm.nih.gov/27851693/
27847102,Influence of different menstrual phases on the Bispectral Index during dexmedetomidine sedation.,The Kaohsiung journal of medical sciences,2016,"Han C, Ge SJ, Huang SQ, Lu YJ, Li N","To investigate the influence of different menstrual phases on the Bispectral Index (BIS) during dexmedetomidine (Dex) sedation, 40 patients with regular menstrual cycle, American Society of Anesthesiologists I-II, aged 18-40 years, undergoing selective gynecologic laparoscopic surgery, were enrolled. According to different menstrual phases and the serum progesterone concentration, they were divided into two groups: the follicular phase group (Group F) and the luteal phase group (Group L), and each group had 20 patients. Before anesthesia induction, patients were infused with an initial loading dose of Dex (1 μg/kg) for 10 minutes and then 0.5 μg/kg/h for 20 minutes. BIS and the changes in hemodynamic and respiratory parameters were recorded within those 30 minutes. Time to lower BIS to 70 and 60 in Group L was shorter than that in Group F (9.4 ± 1.3 minutes vs. 11.3 ± 2.1 minutes, p = 0.005; 11.3 ± 2.4 minutes vs. 14.0 ± 3.6 minutes, p = 0.021). The number of patients whose BIS reached 50 in Group L was greater than that in Group F (15 vs. 8, p < 0.05). The lowest BIS value in the Group L was lower than that in Group F (46.8 ± 6.3 vs. 55.3 ± 5.5, p = 0.006), and the heart rate of patients in both groups showed a decrease (p < 0.05). The sedative effect of Dex was more significant in patients during the luteal phase than during the follicular phase.",https://pubmed.ncbi.nlm.nih.gov/27847102/
27606612,"Determination of loss of consciousness: a comparison of clinical assessment, bispectral index and electroencephalogram: An observational study.",European journal of anaesthesiology,2016,"Zetterlund EL, Gréen H, Oscarsson A, Vikingsson S, Vrethem M, Lindholm ML, Eintrei C","Computer-processed algorithms of encephalographic signals are widely used to assess the depth of anaesthesia. However, data indicate that the bispectral index (BIS), a processed electroencephalography monitoring system, may not be reliable for assessing the depth of anaesthesia.
The aim of this study was to evaluate the ability of the BIS monitoring system to assess changes in the level of unconsciousness, specifically during the transition from consciousness to unconsciousness, in patients undergoing total intravenous anaesthesia with propofol. We compared BIS with the electroencephalogram (EEG), and clinical loss of consciousness (LOC) defined as loss of verbal commands and eyelash reflex.
This was an observational cohort study.
University Hospital Linköping, University Hospital Örebro, Finspång Hospital and Kalmar Hospital, Sweden from October 2011 to April 2013.
A total of 35 ASA I patients aged 18 to 49 years were recruited.
The patients underwent total intravenous anaesthesia with propofol and remifentanil for elective day-case surgery. Changes in clinical levels of consciousness were assessed by BIS and compared with assessment of stage 3 neurophysiological activity using the EEG. The plasma concentrations of propofol were measured at clinical LOC and 20 and 30 min after LOC.
The primary outcome was measurement of BIS, EEG and clinical LOC.
The median BIS value at clinical LOC was 38 (IQR 30 to 43), and the BIS values varied greatly between patients. There was no correlation between BIS values and EEG stages at clinical LOC (r = -0.1, P = 0.064). Propofol concentration reached a steady state within 20 min.
There was no statistically significant correlation between BIS and EEG at clinical LOC. BIS monitoring may not be a reliable method for determining LOC.
This trial was not registered because registration was not mandatory at the time of the trial.",https://pubmed.ncbi.nlm.nih.gov/27606612/
27756208,Effect of the severity of liver dysfunction on the minimum alveolar concentration of sevoflurane responding to an electronic stimulation in cirrhotic patients.,BMC anesthesiology,2016,"Yin Y, Xiao H, Han J, Zhang W, Cheng J, Zhu T","It has been observed that patients with liver dysfunction need lower dose anesthetic compared patients with normal liver function. The minimum amount of volatile anesthetic to achieve an optimal depth of anesthesia for these patients is still unclear. In this study, Minimum alveolar concentration (MAC) of the sevoflurane was determined using an electric stimulation and the effect of severity of liver dysfunction on the MAC was observed in cirrhotic patients.
Thirty patients undergoing upper abdominal surgery were divided into the following groups: group N (normal liver function), group A (Child-Pugh grade A) and group B (Child-Pugh grade B-C). Neuropsychological tests were performed before surgery. We measured MAC
According to the neuropsychological tests, there were 7 and 4 patients with minimal hepatic encephalopathy in Groups B and A, respectively. MAC
MAC
This study has been registered in the Chinese Clinical Trial Register in August 3, 2011 (No. ChiCTR-TRC-11001507 ).",https://pubmed.ncbi.nlm.nih.gov/27756208/
27707001,Comparison of simultaneous and sequential administration of fentanyl-propofol for surgical abortion: a randomized single-blinded controlled trial.,"Artificial cells, nanomedicine, and biotechnology",2017,"Gao W, Sha B, Zhao Y, Fan Z, Liu L, Shen X","Propofol lipid emulsion (PLE) is a nanosized sedative, and it is used with a combination of salted antalgic prodrug, fentanyl citrate (FC). To illustrate the synergistic effect of mixing, we compared the sedation/analgesia resulting from simultaneous and sequential administration in surgically induced abortion (No. ChiCTR-IPC-15006153). Simultaneous group showed lower bispectral index, blood pressure, and heart rate, when cannula was inserted into the uterus. It also showed less frequency of hypertension, sinus tachycardia, movement, pain at the injection site, and additional FC. Therefore, premixing of PLE and FC enhanced the sedation and analgesia; stabilized the hemodynamics; lessened the incidence of movement and injection pain; and reduced the requirement of drugs.",https://pubmed.ncbi.nlm.nih.gov/27707001/
27687464,Effects of music on sedation depth and sedative use during pediatric dental procedures.,Journal of clinical anesthesia,2016,"Ozkalayci O, Araz C, Cehreli SB, Tirali RE, Kayhan Z","The study aimed to investigate the effects of listening to music or providing sound isolation on the depth of sedation and need for sedatives in pediatric dental patients.
Prospective, randomized, and controlled study.
Tertiary, university hospital.
In total, 180 pediatric patients, American Society of Anesthesiologists physical status I and II, who were scheduled for dental procedures of tooth extraction, filling, amputation, and root treatment.
Patients were categorized into 3 groups: music, isolation, and control. During the procedures, the patients in the music group listened to Vivaldi's The Four Seasons violin concertos by sound-isolating headphones, whereas the patients in the isolation group wore the headphones but did not listen to music. All patients were sedated by 0.1 mg/kg midazolam and 1 mg/kg propofol. During the procedure, an additional 0.5 mg/kg propofol was administered as required.
Bispectral index was used for quantifying the depth of sedation, and total dosage of the propofol was used for sedative requirements. The patients' heart rates, oxygen saturations, and Observer's Assessment of Alertness and Sedation Scale and bispectral index scores, which were monitored during the operation, were similar among the groups. In terms of the amount of propofol used, the groups were similar. Prolonged postoperative recovery cases were found to be significantly frequent in the control group, according to the recovery duration measurements (P = .004).
Listening to music or providing sound isolation during pediatric dental interventions did not alter the sedation level, amount of medication, and hemodynamic variables significantly. This result might be due to the deep sedation levels reached during the procedures. However, listening to music and providing sound isolation might have contributed in shortening the postoperative recovery duration of the patients.",https://pubmed.ncbi.nlm.nih.gov/27687464/
27687412,Insomnia may increase anesthetic requirement.,Journal of clinical anesthesia,2016,"Erden V, Abitağaoğlu S, Güler C, Doğan Z, Kırgezen Ş, Abut Y",,https://pubmed.ncbi.nlm.nih.gov/27687412/
27687392,Inappropriately low bispectral index of the elderly during emergence from sevoflurane anesthesia.,Journal of clinical anesthesia,2016,Hayashi K,,https://pubmed.ncbi.nlm.nih.gov/27687392/
27681862,Propofol Pharmacodynamics and Bispectral Index During Key Moments of Awake Craniotomy.,Journal of neurosurgical anesthesiology,2018,"Soehle M, Wolf CF, Priston MJ, Neuloh G, Bien CG, Hoeft A, Ellerkmann RK","During awake craniotomy, the patient's language centers are identified by neurological testing requiring a fully awake and cooperative patient. Hence, anesthesia aims for an unconscious patient at the beginning and end of surgery but an awake and responsive patient in between. We investigated the plasma (Cplasma) and effect-site (Ceffect-site) propofol concentration as well as the related Bispectral Index (BIS) required for intraoperative return of consciousness and begin of neurological testing.
In 13 patients, arterial Cplasma were measured by high-pressure liquid chromatography and Ceffect-site was estimated based on the Marsh and Schnider pharmacokinetic/dynamic (pk/pd) models. The BIS, Cplasma and Ceffect-site were compared during the intraoperative awakening period at designated time points such as return of consciousness and start of the Boston Naming Test (neurological test).
Return of consciousness occurred at a BIS of 77±7 (mean±SD) and a measured Cplasma of 1.2±0.4 μg/mL. The Marsh model predicted a significantly (P<0.001) higher Cplasma of 1.9±0.4 µg/mL as compared with the Schnider model (Cplasma=1.4±0.4 µg/mL) at return of consciousness. Neurological testing was possible as soon as the BIS had increased to 92±6 and measured Cplasma had decreased to 0.8±0.3 µg/mL. This translated into a time delay of 23±12 minutes between return of consciousness and begin of neurological testing. At begin of neurological testing, Cplasma according to Marsh (Cplasma=1.3±0.5 µg/mL) was significantly (P=0.002) higher as compared with the Schnider model (Cplasma=1.0±0.4 µg/mL).
To perform intraoperative neurological testing, patients are required to be fully awake with plasma propofol concentrations as low as 0.8 µg/mL. Following our clinical setup, the Schnider pk/pd model estimates propofol concentrations significantly more accurate as compared with the Marsh model at this neurologically crucial time point.",https://pubmed.ncbi.nlm.nih.gov/27681862/
27598398,Bispectral Index Monitoring Reduces the Dosage of Propofol and Adverse Events in Sedation for Endobronchial Ultrasound.,Respiration; international review of thoracic diseases,2016,"Quesada N, Júdez D, Martínez Ubieto J, Pascual A, Chacón E, De Pablo F, Mincholé E, Bello S","Current guidelines recommend monitoring the anesthetic depth of sedation during respiratory endoscopy by using clinical scales despite their subjective nature and the potential change in the level of sedation caused by frequent stimulation. Monitoring by means of the bispectral index (BIS) has shown its utility in reducing the use of drugs and their adverse events in general anesthesia, but evidence in prolonged sedation is insufficient.
Our objective was to evaluate BIS in patients undergoing endobronchial ultrasound (EBUS).
A randomized cohort study of 90 patients with mediastinal lymph node involvement and/or lung or mediastinal lesions for whom EBUS was indicated, comparing the modified observer's assessment of alertness/sedation scale clinical evaluation (n = 45) versus the BIS evaluation (n = 45) of sedation with propofol-remifentanil, was conducted in order to evaluate the clinical parameters, doses used, adverse events, and tolerance of the procedure.
We found a shorter waking time and a significantly lower dose of total propofol in the BIS group. Significantly fewer overall adverse events were recorded in the BIS group and included desaturation, hypotension, and bradypnea. Tolerance was better in the BIS group. No significant differences were found in terms of cough, memory of the procedure, or the level of difficulty of EBUS on the part of the pulmonologists.
BIS monitoring of sedation in EBUS makes it possible to reduce the dosage of propofol, thereby shortening the waking time and reducing adverse events. This form of monitoring should be taken into consideration in the future for systematic use in prolonged sedation, as in the case of EBUS.",https://pubmed.ncbi.nlm.nih.gov/27598398/
27555197,The effects of caudal or intravenous dexmedetomidine on postoperative analgesia produced by caudal bupivacaine in children: a randomized controlled double-blinded study.,Journal of clinical anesthesia,2016,"Al-Zaben KR, Qudaisat IY, Alja'bari AN, Ababneh OA, Yousef AM, Al-Shudifat AM","The aim of this study was to compare the effects of caudal and intravenous (IV) dexmedetomidine (1 μg/kg) on postoperative analgesia after caudal bupivacaine in pediatric patients undergoing lower abdominal and perineal surgeries.
A randomized controlled double-blind study.
University-affiliated teaching hospital.
Seventy-five American Society of Anesthesiologists I children, aged 1 to 6 years.
Patients were randomly allocated to 3 groups. All patients received 1 mL/kg caudal 0.25% bupivacaine. In addition, those in group B (n=25) received 10-mL IV saline, those in group B-Dcau (n=25) received 1 μg/kg caudal dexmedetomidine and 10-mL IV saline, and those in group B-DIV (n=25) received 1 μg/kg IV dexmedetomidine in 10-mL saline.
Intraoperative mean blood pressure, heart rate, peripheral oxygen saturation, end-tidal sevoflurane, and bispectral index as well as postoperative pain and behavior scores and time to first analgesia were assessed.
Group B-Dcau had a significantly longer time to first rescue analgesia than groups B-DIV and B, with mean (SD) values of 14.4 (7.5), 9.18 (2.7), and 6.6 (2.5) hours, respectively (P<.05). Fewer patients in group B-Dcau (n=16) required rescue analgesia during the first 24 hours postoperatively compared to group B (n=24) and group B-DIV (n=20) (P<.05). Groups B-Dcau and B-DIV had lower pain and behavior scores than Group B. Eight patients Group B had agitation compared to 2 in Group B-DIV and 0 in Group B-Dcau. Four patients in Group B-DIV developed bradycardia and hypotension during surgery.
Compared to IV administration, caudal administration of dexmedetomidine during caudal bupivacaine anesthesia provided prolonged postoperative analgesia and a greater analgesic sparing effect without significant side effects. This suggests a greater role of neuraxial compared to that of peripheral α-2 adrenoceptors in pain processing.",https://pubmed.ncbi.nlm.nih.gov/27555197/
27484701,Effects of Dexmedetomidine on motor- and somatosensory-evoked potentials in patients with thoracic spinal cord tumor: a randomized controlled trial.,BMC anesthesiology,2016,"Li Y, Meng L, Peng Y, Qiao H, Guo L, Han R, Gelb AW","We hypothesized that the addition of dexmedetomidine in a clinically relevant dose to propofol-remifentanil anesthesia regimen does not exert an adverse effect on motor-evoked potentials (MEP) and somatosensory-evoked potentials (SSEP) in adult patients undergoing thoracic spinal cord tumor resection.
Seventy-one adult patients were randomized into three groups. Propofol group (n = 25): propofol-remifentanil regimenand the dosage was adjusted to maintain the bispectral index (BIS) between 40 and 50. DP adjusted group (n = 23): Dexmedetomidine (0.5 μg/kg loading dose infused over 10 min followed by a constant infusion of 0.5 μg/kg/h) was added to the propofol-remifentanil regimen and propofol was adjusted to maintain BIS between 40 and 50. DP unadjusted group (n = 23): Dexmedetomidine (administer as DP adjusted group) was added to the propofol-remifentanil regimen and propofol was not adjusted. All patients received MEP, SSEP and BIS monitoring.
There were no significant changes in the amplitude and latency of MEP and SSEP among different groups (P > 0.05). The estimated propofol plasma concentration in DP adjusted group (2.7 ± 0.3 μg/ml) was significantly lower than in propofol group (3.1 ± 0.2 μg/ml) and DP unadjusted group (3.1 ± 0.2 μg/ml) (P = 0.000). BIS in DP unadjusted group (35 ± 5) was significantly lower than in propofol group (44 ± 3) (P = 0.000).
The addition of dexmedetomidine to propofol-remifentanil regimen does not exert an adverse effect on MEP and SSEP monitoring in adult patients undergoing thoracic spinal cord tumor resection.
The study was registered with the Chinese Clinical Trial Registry on January 31st, 2014. The reference number was ChiCTR-TRC-14004229.",https://pubmed.ncbi.nlm.nih.gov/27484701/
