PMID,Title,Journal,PubDate,Authors,Abstract,PubMedURL
23027226,BIS-guided anesthesia decreases postoperative delirium and cognitive decline.,Journal of neurosurgical anesthesiology,2013,"Chan MT, Cheng BC, Lee TM, Gin T, ","Previous clinical trials and animal experiments have suggested that long-lasting neurotoxicity of general anesthetics may lead to postoperative cognitive dysfunction (POCD). Brain function monitoring such as the bispectral index (BIS) facilitates anesthetic titration and has been shown to reduce anesthetic exposure. In a randomized controlled trial, we tested the effect of BIS monitoring on POCD in 921 elderly patients undergoing major noncardiac surgery.
Patients were randomly assigned to receive either BIS-guided anesthesia or routine care. The BIS group had anesthesia adjusted to maintain a BIS value between 40 and 60 during maintenance of anesthesia. Routine care group had BIS measured but not revealed to attending anesthesiologists. Anesthesia was adjusted according to traditional clinical signs and hemodynamic parameters. A neuropsychology battery of tests was administered before and at 1 week and 3 months after surgery. Results were compared with matched control patients who did not have surgery during the same period. Delirium was measured using the confusion assessment method criteria.
The median (interquartile range) BIS values during the maintenance period of anesthesia were significantly lower in the control group, 36 (31 to 49), compared with the BIS-guided group, 53 (48 to 57), P<0.001. BIS-guided anesthesia reduced propofol delivery by 21% and that for volatile anesthetics by 30%. There were fewer patients with delirium in the BIS group compared with routine care (15.6% vs. 24.1%, P=0.01). Although cognitive performance was similar between groups at 1 week after surgery, patients in the BIS group had a lower rate of POCD at 3 months compared with routine care (10.2% vs. 14.7%; adjusted odds ratio 0.67; 95% confidence interval, 0.32-0.98; P=0.025).
BIS-guided anesthesia reduced anesthetic exposure and decreased the risk of POCD at 3 months after surgery. For every 1000 elderly patients undergoing major surgery, anesthetic delivery titrated to a range of BIS between 40 and 60 would prevent 23 patients from POCD and 83 patients from delirium.",https://pubmed.ncbi.nlm.nih.gov/23027226/
22928590,Can electromyographic arousal be detected visually on the Datex-Ohmeda S/5™ anesthesia monitor?,Acta anaesthesiologica Scandinavica,2013,"Aho AJ, Yli-Hankala A, Lyytikäinen LP, Kamata K, Jäntti V","Electroencephalogram (EEG)-based depth of anaesthesia monitoring is susceptible to contaminating electromyographic (EMG) activity. Many authorities have suggested that anaesthesiologists using these monitors should interpret the raw EEG waveform seen on the anaesthesia monitor.
In 34 patients anaesthetized with propofol using two doses of rocuronium (0.6 and 1.2 mg/kg), we studied whether the EMG arousal can be detected visually on the anaesthesia monitor. The Bispectral Index (BIS) and Entropy biosignals on the monitor were recorded with a video camera, and the one-channel EEG recorded by the Entropy strip was collected on a laptop computer. The recordings and the one-channel EEG were analyzed offline by two experts (anaesthesiologist and neurophysiologist), both with a long experience on anaesthesia-related EEG.
EMG arousal existed in 14/34 and 13/33 patients in the BIS and Entropy biosignals, respectively. The anaesthesiologist detected EMG on the monitor in 7/14 patients with BIS (sensitivity 50%) and in 4/13 patients with Entropy (31%). The clinical neurophysiologist detected EMG in 6/14 (43%) patients with BIS and in 5/13 (38%) with Entropy. The specificity of the EMG analyses was 55 and 65% with BIS, and 85 and 90% with Entropy. EMG arousal was detected in BIS biosignal in 10/17 and 4/17 patients with 0.6 and 1.2 mg/kg doses of rocuronium (P = 0.04).
In contrast to many EEG phenomena, EMG activity cannot be accurately detected visually from the raw EEG on the anaesthesia monitor. Further development in the quality of the anaesthesia monitors is warranted.",https://pubmed.ncbi.nlm.nih.gov/22928590/
22834710,Design and implementation of a closed-loop control system for infusion of propofol guided by bispectral index (BIS).,Acta anaesthesiologica Scandinavica,2012,"Reboso JA, Méndez JA, Reboso HJ, León AM","This study describes the design of a hypnosis closed-loop control system with propofol. The controller used a proportional-integral (PI) algorithm with the bispectral index (BIS) as the feedback signal. Our hypothesis was that a PI closed-loop control could be applied in clinical practice safely keeping the BIS within a pre-determined target range.
The adjustment of the PI parameters was based on simulation. The procedure had three steps: obtaining a patient model using data from 12 patients, designing and adjusting the controller in simulation, and fine tuning the PI parameters in a pilot study (10 patients). The resulting controller was tested in 24 American Society of Anesthesiology (ASA) I-II patients. The controller directly decides the infusion rate of propofol, and no model is necessary in its online operation. The BIS target was set to 50. Remifentanil was used for analgesia.
We evaluated the efficiency and safety of the automatic feedback system. It worked properly in all the patients. The median performance error was -1.62, and the median absolute performance error was 11.03. Average propofol-normalized consumption was 5.3 ± 1.8 mg/kg/h. Mean percentage of BIS in the range 40-60 was 83%. Mean time to open eyes was 8 ± 4 min. Time to extubation was 9 ± 5 min. Hemodynamic adverse event or intraoperative awareness were not recorded.
The closed-loop system was able to maintain the BIS within an acceptable range of levels. The control of a propofol infusion guided by the BIS is feasible without hemodynamic instability in ASA I/II patients.",https://pubmed.ncbi.nlm.nih.gov/22834710/
22828857,The utility of bispectral index monitoring for sedated patients treated with low-dose remifentanil.,Journal of clinical monitoring and computing,2012,"Kato T, Koitabashi T, Ouchi T, Serita R","The aim of the present study was to determine the effect of low-dose remifentanil on the monitoring quality of the Bispectral index for mechanically ventilated patients. Twelve patients who underwent elective surgery and required mechanical ventilation post-operatively were enrolled in this study with written informed consent. Eligible patients were divided into two groups. Patients in the remifentanil group received low-dose remifentanil (0.05-0.125 μg/kg/min) and propofol (1-3 mg/kg/h). Patients in the control group received propofol (1-3 mg/kg/h). Levels of sedation were evaluated by both the Richmond Agitation Sedation Scale (RASS) and BIS monitor (A2000-XP, version 4.0, Aspect Medical Systems, Newton, USA). Monitoring quality was assessed by a correlation between RASS and BIS values. These values were assessed by single regression analysis and a P value of <0.05 was considered significant. There was a significant correlation between RASS and BIS values (P = 3 × 10(-12), R (2) = 0.67) in the remifentanil group, but not in the control group (P = 0.50, R (2) = 0.057). The administration of low-dose remifentanil makes BIS a more precise tool for sedated patients under mechanical ventilation in the ICU.",https://pubmed.ncbi.nlm.nih.gov/22828857/
22774408,Assesment of correlation between bispectral index and four common sedation scales used in mechanically ventilated patients in ICU.,European review for medical and pharmacological sciences,2012,"Yaman F, Ozcan N, Ozcan A, Kaymak C, Basar H","The aim of this study was to compare the correlation between bispectral index (BIS) monitor and four commonly used subjective clinical scales (Ramsay Sedation Scale (RSS), Richmond Agitation Sedation Scale (RASS), Sedation Agitation Scale, Adaptation to Intensive Care Environment scale) in mechanically ventilated patients in intensive care unit (ICU). In addition, comparison of responsiveness of the clinical scales in respect to BIS changes is another goal of this study.
Mechanically ventilated thirty patients who required sedation for any reason were enrolled to study. Patients who needed neuromuscular blockade, patients with known hearing and visual problems, neurological diseases, anoxic encephalopathy, mental retardation and who developed hemodynamic instability (mean arterial pressure below 60 mmHg) and hypoxemia (sPO2 below 90%) during follow-up were excluded. Starting before the initiation of sedation, first BIS scores then clinical sedation scales were evaluated. This procedure is repeated every 2 hours for 24 hours.
All of the four clinical scales were significantly correlated with BIS. BIS and clinical scale values, except Adaptation to Intensive Care Environment scale, showed significant changes compared to baseline after the initiation of sedation. Ramsay and Richmond scales showed the highest correlation with BIS (respectively, r = 0.758, r = 0.750). Adaptation to Intensive Care Environment revealed the lowest correlation (r = 0.565).
All of the scales were significantly correlated with BIS. RSS and RASS showed higher correlation than other scales. As a conclusion: RSS and RASS can be used for monitoring the depth of sedation in mechanically ventilated patients in ICU.",https://pubmed.ncbi.nlm.nih.gov/22774408/
22546967,"Hospital stay and mortality are increased in patients having a ""triple low"" of low blood pressure, low bispectral index, and low minimum alveolar concentration of volatile anesthesia.",Anesthesiology,2012,"Sessler DI, Sigl JC, Kelley SD, Chamoun NG, Manberg PJ, Saager L, Kurz A, Greenwald S","Low mean arterial pressure (MAP) and deep hypnosis have been associated with complications and mortality. The normal response to high minimum alveolar concentration (MAC) fraction of anesthetics is hypotension and low Bispectral Index (BIS) scores. Low MAP and/or BIS at lower MAC fractions may represent anesthetic sensitivity. The authors sought to characterize the effect of the triple low state (low MAP and low BIS during a low MAC fraction) on duration of hospitalization and 30-day all-cause mortality.
Mean intraoperative MAP, BIS, and MAC were determined for 24,120 noncardiac surgery patients at the Cleveland Clinic, Cleveland, Ohio. The hazard ratios associated with combinations of MAP, BIS, and MAC values greater or less than a reference value were determined. The authors also evaluated the association between cumulative triple low minutes, and excess length-of-stay and 30-day mortality.
Means (±SD) defining the reference, low, and high states were 87 ± 5 mmHg (MAP), 46 ± 4 (BIS), and 0.56 ± 0.11 (MAC). Triple lows were associated with prolonged length of stay (hazard ratio 1.5, 95% CI 1.3-1.7). Thirty-day mortality was doubled in double low combinations and quadrupled in the triple low group. Triple low duration ≥60 min quadrupled 30-day mortality compared with ≤15 min. Excess length of stay increased progressively from ≤15 min to ≥60 min of triple low.
The occurrence of low MAP during low MAC fraction was a strong and highly significant predictor for mortality. When these occurrences were combined with low BIS, mortality risk was even greater. The values defining the triple low state were well within the range that many anesthesiologists tolerate routinely.",https://pubmed.ncbi.nlm.nih.gov/22546967/
22459647,Electroacupuncture reduces the dose of midazolam monitored by the bispectral index in critically ill patients with mechanical ventilation: an exploratory study.,Acupuncture in medicine : journal of the British Medical Acupuncture Society,2012,"Zheng X, Meng JB, Fang Q","Electroacupuncture, a modern variation on a traditional Chinese treatment, might be useful for sedation and analgesia. This study aims to investigate whether electroacupuncture can modify the dose of midazolam monitored by the bispectral index (BIS) in critically ill patients with mechanical ventilation.
Orotracheally intubated patients undergoing mechanical ventilation were randomly assigned into three groups (groups A, B and C). All patients were given an intravenous infusion of midazolam. Patients in group A received no additional treatment. Patients in group B were given acupuncture without electrical stimulation at acupuncture points GV24 and EX-HN3 (Yintang) for 6 h simultaneously, and patients in group C were given electroacupuncture to the same points as in group B.
Maintaining the BIS between 60 and 80, the hourly mean one dose of midazolam within the first 6 h after sedation in group C was 0.05 (±0.02 mg/kg per hour), which was significantly lower than both group A (0.08 ± 0.03 mg/kg per hour, p<0.001) and group B (0.07 ± 0.01 mg/kg per hour, p<0.021). The doses in groups A and B showed no significant difference. Between-group comparison analysis of hepatic and renal function and severe adverse reactions all showed no significant difference between the three groups.
Electroacupuncture appears to reduce markedly the dose of sedative drug required in critically ill patients with mechanical ventilation monitored by BIS, without any obvious severe adverse action, and larger studies to confirm the effect are justified.",https://pubmed.ncbi.nlm.nih.gov/22459647/
22442778,Utility of bispectral index monitoring during intravenous sedation in the dental office.,The International journal of oral & maxillofacial implants,2012,"Munoz Garcia J, Vidal Marcos AV, Restoy Lozano A, Gasco Garcia C","This research sought to compare two different systems to monitor sedated patients undergoing implant surgery in the dental office: the bispectral index (BIS) and the Ramsay scale. This information was used to establish an optimal BIS range for surgery in these patients and to calculate differences in drug consumption in both groups.
Consecutive patients undergoing implant surgery were studied and randomly assigned to two groups. Patients were sedated using intravenous propofol, fentanyl, and midazolam. The sedation level in group A was measured using the Ramsay scale. In group B, the Ramsay scale and the BIS were used together. Heart rate, blood pressure, and peripheral oxygen saturation were monitored in all patients. The levels of anxiety, satisfaction, and drug consumption were compared between groups.
Forty-three patients were included; 20 were placed in group A and 23 were included in group B. There were no differences in the hemodynamic and respiratory parameters monitored or in anxiety or satisfaction levels in both groups. In group B patients, the BIS values stabilized around 85; the Ramsay scale stabilized around 3 in both groups and remained at these levels until the end of the procedure. Drug consumption was significantly lower in the BIS group.
The optimal BIS value during intravenous sedation in sedated ambulatory patients in dental surgery should be within the 80 to 85 range. BIS monitoring allows for reduced consumption of propofol, fentanyl, and midazolam.",https://pubmed.ncbi.nlm.nih.gov/22442778/
22381986,"Bispectral index values, sedation-agitation scores, and plasma Lorazepam concentrations in critically ill surgical patients.","American journal of critical care : an official publication, American Association of Critical-Care Nurses",2012,"LeBlanc JM, Dasta JF, Pruchnicki MC, Gerlach A, Cook C","Publications on the use of the bispectral index for sedation monitoring in the intensive care unit are increasing. However, few studies have involved correlation of bispectral index with serum drug concentrations.
To assess the degree of correlation between bispectral index values, scores on the Sedation-Agitation Scale, and steady-state serum concentrations of lorazepam.
A prospective open-label study of patients in a surgical intensive care unit who were receiving mechanical ventilation and continuous infusions of lorazepam for more than 24 hours. Bispectral index was measured (BIS-XP, Aspect Medical, Norwood, Massachusetts) to assess patients' sedation. Sensors were applied and values recorded before and after stimulation (endotracheal suctioning). Concomitant plasma samples were obtained to measure lorazepam concentration and scores on the Sedation-Agitation Scale were recorded.
Sixteen patients were studied. Correlations between plasma concentrations of lorazepam and measurements of bispectral index for 1, 2, and 3 minutes before endotracheal stimulation were poor (0.21, 0.29, and 0.25, respectively). Correlation of peak values for bispectral index (after stimulation) with plasma concentrations of lorazepam was 0.29. Correlations of scores on the Sedation-Agitation Scale with the aforementioned values for bispectral index were similarly poor. Area under the curve for bispectral index values also correlated poorly with plasma concentration of lorazepam (0.19) and score on the Sedation-Agitation Scale (0.10).
The correlation between bispectral index and score on the Sedation-Agitation Scale was poor. Correlation between bispectral index and plasma concentration of lorazepam was modestly better, but insufficient for clinical utility.",https://pubmed.ncbi.nlm.nih.gov/22381986/
22340376,Evaluation of high-concentration sevoflurane for induction and nasotracheal intubation without muscle relaxant for infants with different pulmonary blood flow undergoing surgery for congenital heart diseases.,Chinese medical journal,2011,"Wang KY, Wang HW, Xin LF, Wang YW, Xue YL","Inhalational anesthesia with sevoflurane for endotracheal intubation without muscle relaxant is now used widely for pediatric patients. This study assessed the efficacy and safety of induction with high concentration sevoflurane and of nasotracheal intubation without muscle relaxant in infants with increased or decreased pulmonary blood flow (PBF) and undergoing surgery for congenital heart diseases.
Fifty-five infants aged 2 - 12 months, weighing 4.7 - 10.0 kg, and scheduled for congenital cardiac surgery were enrolled. Subjects were divided into those with increased (IPBF group, n = 29) and decreased (DPBF group, n = 26) pulmonary blood flow. All infants received inhalational induction with 8% sevoflurane in 100.0% oxygen at a gas flow rate of 6 L/min. Nasotracheal intubation was performed 4 minutes after induction. Sevoflurane vaporization was decreased to 4.0% for placement of a peripheral intravenous line and invasive hemodynamic monitors. Five minutes later, sedatives and muscle relaxant were administered and the vaporizer was adjusted to 2% for maintenance of anesthesia. Bispectral index (BIS) scores, circulatory parameters, satisfactory and successful intubation ratios, adverse reactions, and complications of intubation were recorded.
Times to loss of lash and pain reflexes were longer for the DPBF group (P < 0.01). Satisfactory intubation ratios were 93.1% and 61.5% for the IPBF and DPBF groups, respectively (P = 0.008). Successful intubation ratios were 96.6% and 76.9% for the IPBF and DPBF groups, respectively (P = 0.044). Following sevoflurane inhalation, blood pressures decreased significantly in the IPBF group but remained stable in the DPBF group. BIS scores declined to similar stable values, and a ""nadir BIS"" was recorded for both groups. No obvious adverse reactions or complications of intubation were noted perioperatively.
Induction with high concentration sevoflurane, although faster for infants with IPBF, is safe for infants with IPBF or DPBF. However, nasotracheal intubation without muscle relaxant after induction with high concentration sevoflurane is less successful and less satisfactory for infants with DPBF and should be used with caution in this patient group.",https://pubmed.ncbi.nlm.nih.gov/22340376/
22301207,"Systemic lidocaine decreases the Bispectral Index in the presence of midazolam, but not its absence.",Journal of clinical anesthesia,2012,"Gottschalk A, McKay AM, Malik ZM, Forbes M, Durieux ME, Groves DS","To evaluate the effects of intravenous (IV) lidocaine on the Bispectral Index (BIS) in the presence or absence of midazolam.
Prospective, randomized, double-blinded, placebo-controlled clinical study.
Operating room of a university hospital.
96 ASA physical status 1, 2, and 3 patients undergoing general anesthesia.
Patients were assigned to one of 6 treatment groups to receive IV midazolam (0.03 mg/kg) or placebo, followed 5 minutes later by one of three IV preinduction doses of lidocaine: 0.5, 1.0, or 1.5 mg/kg.
BIS values were recorded before administration of lidocaine and at 30-second intervals afterwards for three minutes. The primary endpoint was the average BIS level recorded.
Baseline BIS values were lower in the midazolam group (94 ± 4 vs. 90 ± 7, P < 0.001). There was no significant decrease in BIS values in the placebo group for any of the three lidocaine doses. However, in the midazolam groups, significant decreases in BIS levels versus baseline values were measured.
IV lidocaine decreases BIS in the presence of midazolam, suggesting that the effect of lidocaine on BIS is not direct, but rather results from modulation by midazolam.",https://pubmed.ncbi.nlm.nih.gov/22301207/
22289106,Elevated BIS and Entropy values after sugammadex or neostigmine: an electroencephalographic or electromyographic phenomenon?,Acta anaesthesiologica Scandinavica,2012,"Aho AJ, Kamata K, Yli-Hankala A, Lyytikäinen LP, Kulkas A, Jäntti V","Sugammadex is designed to antagonize neuromuscular blockade (NMB) induced by rocuronium or vecuronium. In clinical practice, we have noticed a rise in the numerical values of bispectral index (BIS) and Entropy, two electroencephalogram (EEG) - based depth of anesthesia monitors, during the reversal of the NMB with sugammadex. The aim of this prospective, randomized, double-blind study was to test this impression and to compare the effects of sugammadex and neostigmine on the BIS and Entropy values during the reversal of the NMB.
Thirty patients undergoing gynecological operations were studied. Patients were anesthetized with target-controlled infusions of propofol and remifentanil, and rocuronium was used to induce NMB. After operation, during light propofol-remifentanil anesthesia, NMB was antagonized with sugammadex or neostigmine. During the following 5 min, the numerical values of BIS, BIS electromyographic (BIS EMG) and Entropy were recorded on a laptop computer, as well as the biosignal recorded by the Entropy strip. The Entropy biosignal was studied off-line both in time and frequency domain to see if NMB reversal causes changes in EEG.
In some patients, administration of sugammadex or neostigmine caused a significant rise in the numerical values of BIS, BIS EMG and Entropy. This phenomenon was most likely caused by increased electromyographic (EMG) activity. The administration of sugammadex or neostigmine appeared to have only minimal effect on EEG.
The EMG contamination of EEG causes BIS and Entropy values to rise during reversal of rocuronium-induced NMB in light propofol-remifentanil anesthesia.",https://pubmed.ncbi.nlm.nih.gov/22289106/
22248772,Bispectral index and other processed parameters of electroencephalogram: an update.,Revista brasileira de anestesiologia,2012,"Nunes RR, Chaves IM, de Alencar JC, Franco SB, de Oliveira YG, de Menezes DG","The processed analysis of electroencephalogram became extremely important to monitor nervous system, being used to obtain a better anesthetic adequacy. The objective was to conduct a review about each processed parameter, defining its real importance.
A review was conducted showing mathematical, physical and clinical aspects as well as their correlations and updates, presenting new integrated parameters.
An adequate analysis of processed parameters of electroencephalogram may provide more intraoperative safety as well as result in a better outcome for the patient.",https://pubmed.ncbi.nlm.nih.gov/22248772/
22151064,Clinical sedation and bispectral index in burn children receiving gamma-hydroxybutyrate.,Paediatric anaesthesia,2012,"Rousseau AF, Ledoux D, Sabourdin N, Richard P, Damas P, Constant I","Gamma-hydroxybutyrate (GHB) may be an interesting hypnotic agent in burn patients because of its good respiratory or hemodynamic tolerance. However, its clinical and electroencephalographic (EEG) sedative effects are not yet described in children. The aim of this prospective and randomized study was to assess clinical and EEG effects of increasing intravenous (IV) doses of GHB in burn children requiring sedation for burn wound cares.
Thirty six children hospitalized in a burn care unit were included and randomly assigned into three groups (G) according to the single IV dose of GHB they received before burn wound care: 10 mg · kg(-1) in G10, 25 mg · kg(-1) in G25, or 50 mg · kg(-1) in G50. All patients received oral premedication (morphine and hydroxyzine) 30 min before GHB injection. Respiratory rate, heart rate, pulse oximetry, and bispectral index (BIS) were continuously monitored. Depth of sedation was clinically assessed using Observer's Assessment of Alertness and Sedation (OAAS) Score, every 2 min until recovery (i.e., OAAS = 4).
Median age was 17.5 [12-34] months. Whatever the dose, BIS decreased after IV GHB. Nadir value of BIS was significantly lower in G25 and G50 than in G10, as was for OAAS score. Nadir values were reached after same delays in G25 and G50. Duration of sedation was dose-dependent.
Bispectral index decreased after GHB injection and was correlated with OAAS score. Deep sedation can be safely achieved with IV doses of 25 or 50 mg · kg(-1), but the last dose was associated with prolonged duration of clinical sedation.",https://pubmed.ncbi.nlm.nih.gov/22151064/
