PMID,Title,Journal,PubDate,Authors,Abstract,PubMedURL
15105212,"A comparison of the clinical usefulness of three different electroencephalogram monitors: Bispectral Index, processed electroencephalogram, and Alaris auditory evoked potentials.",Anesthesia and analgesia,2004,"Nishiyama T, Matsukawa T, Hanaoka K","We compared the usefulness of the Bispectral Index (BIS), Processed electroencephalogram (pEEG), and Alaris auditory evoked potentials (A-AEP). Ninety females scheduled for mastectomy were divided into three groups. Anesthesia was induced with propofol and fentanyl to insert a laryngeal mask airway (LMA) and was maintained by adding nitrous oxide. EEG was monitored by either BIS, spectral edge frequency by pEEG, or A-AEP index by A-AEP. We recorded the number of patients with impedance low enough to extract good EEG signals at the first electrodes application (success rate), the number with an index outside of the range considered appropriate for general anesthesia (inappropriateness rate), changes of the index by LMA insertion or surgical incision (responsiveness), and time to return to good EEG signals after signal disturbance by electric cautery (recovery time). The success rate was larger in BIS > or = A-AEP > pEEG. The inappropriateness rate was smaller in A-AEP < or = BIS , or = pEEG. The A-AEP group showed the largest responsiveness. The recovery time was shorter in pEEG < A-AEP < BIS. In summary, the BIS had the largest success rate, the A-AEP had the least inappropriateness rate and the largest responsiveness, and the pEEG had the fastest recovery time.
We compared the usefulness of three electroencephalogram monitors. The Bispectral Index was the easiest for obtaining low impedance, the auditory evoked potential index had the least inappropriateness rate for general anesthesia and had the largest responsiveness, and the spectral edge frequency was the fastest in stabilizing measurement after electric cautery.",https://pubmed.ncbi.nlm.nih.gov/15105212/
15105211,The relationship between bispectral index and electroencephalographic parameters during isoflurane anesthesia.,Anesthesia and analgesia,2004,"Morimoto Y, Hagihira S, Koizumi Y, Ishida K, Matsumoto M, Sakabe T","Bispectral index (BIS) integrates various electroencephalographic (EEG) parameters into a single variable. However, the exact algorithm used to synthesize the parameters to BIS values is not known. The relationship between BIS and EEG parameters was evaluated during nitrous oxide/isoflurane anesthesia. Twenty patients scheduled for elective ophthalmic surgery were enrolled in the study. After EEG recording with a BIS monitor (A-1050) was begun, general anesthesia was induced and maintained with 0.5%-2% isoflurane and 66% nitrous oxide. Using software we developed, we continuously recorded BIS, spectral edge frequency 95% (SEF95), and EEG parameters such as relative beta ratio (BetaRatio), relative synchrony of fast and slow wave (SynchFastSlow), and burst suppression ratio. BetaRatio was linearly correlated with BIS (r = 0.90; P < 0.01; n = 253) at BIS more than 60. At a BIS range of 30 to 80, SynchFastSlow (r = 0.60; P < 0.01; n = 3314) and SEF95 (r = 0.75; P < 0.01; n = 3339) were linearly correlated with BIS. The correlation between BIS and SEF95 was significantly better than the correlation between BIS and SynchFastSlow (P < 0.01). At BIS less than 30, the burst suppression ratio was inversely linearly correlated with BIS (r = 0.76; P < 0.01; n = 65). At BIS less than 80, burst-compensated SEF95 was linearly correlated with BIS (r = 0.78; P < 0.01; n = 3404). In the range of BIS from 60 to 100, BIS can be calculated from BetaRatio. At surgical levels of anesthesia, BIS and SynchFastSlow (a parameter derived from bispectral analysis) or burst-compensated SEF95 (derived from power spectral analysis) are well correlated. However, our results show that SynchFastSlow has no advantage over SEF95 in calculation of BIS.
The relationship between bispectral index (BIS) and electroencephalographic parameters was evaluated during nitrous oxide/isoflurane anesthesia. At surgical levels of anesthesia, BIS and the relative synchrony of fast and slow wave (a parameter derived from bispectral analysis) or burst-compensated spectral edge frequency 95% (a parameter derived from power spectral analysis) are well correlated.",https://pubmed.ncbi.nlm.nih.gov/15105211/
15087616,Electroencephalographic bicoherence is sensitive to noxious stimuli during isoflurane or sevoflurane anesthesia.,Anesthesiology,2004,"Hagihira S, Takashina M, Mori T, Ueyama H, Mashimo T","The authors previously reported changes in electroencephalographic bicoherence during isoflurane anesthesia combined with epidural anesthesia. Here, they examined the influence of noxious stimuli on electroencephalographic bicoherence as well as on the Bispectral Index (BIS) and the 95% spectral edge frequency (SEF95).
The authors enrolled 48 elective abdominal surgery patients (aged 22-77 years; American Society of Anesthesiologists physical status I or II). Raw electroencephalographic signals as well as BIS and SEF95 were recorded on a computer using a BIS monitor (A-1050) and Bispectrum Analyzer (BSA) for BIS (the authors' original software). Using BSA for BIS, the authors evaluated the two peak heights of electroencephalographic bicoherence. Anesthesia was induced with 3 mg/kg thiopental and was maintained with, in air-oxygen, 1.0% isoflurane or 1.5% sevoflurane. After confirming the steady state, the authors recorded baseline values. In experiment 1, they administered 3 microg/kg fentanyl 5 min after incision and investigated the changes in electroencephalographic derivatives at 5 and 10 min after incision. In experiment 2, they administered a similar dose of fentanyl 5 min before incision and investigated the changes in electroencephalographic derivatives immediately before and 5 min after incision.
In experiment 1, after incision, both peak heights of electroencephalographic bicoherence significantly decreased but returned to control values after fentanyl administration. By contrast, after incision, BIS and SEF95 showed individual variability. In experiment 2, although fentanyl itself did not affect all electroencephalographic derivatives before incision, the variables remained unchanged after incision.
Noxious stimuli decreased the peak heights of electroencephalographic bicoherence, an effect that was counteracted by fentanyl analgesia.",https://pubmed.ncbi.nlm.nih.gov/15087616/
14576542,Narcotrend and Bispectral Index monitor are superior to classic electroencephalographic parameters for the assessment of anesthetic states during propofol-remifentanil anesthesia.,Anesthesiology,2003,"Schmidt GN, Bischoff P, Standl T, Jensen K, Voigt M, Schulte Am Esch J","A new electroencephalogram monitor, the Narcotrend, was developed to measure anesthetic depth. The authors compared the Narcotrend, the Bispectral Index, and classic electroencephalographic and hemodynamic parameters during anesthesia with propofol and remifentanil.
The authors investigated 25 patients undergoing laminectomy at different anesthetic states: awake, steady state anesthesia, first reaction during emergence, and extubation. Narcotrend value; BIS; relative power (percent) in delta, theta, alpha, and beta; median frequency; spectral edge frequency; and hemodynamic parameters were recorded simultaneously. The ability of the classic and processed electroencephalographic and hemodynamic parameters to predict the clinically relevant anesthetic states of awake, steady state anesthesia, first reaction, and extubation was tested using prediction probability.
Only the Narcotrend was able to differentiate between awake versus steady state anesthesia and steady state anesthesia versus first reaction/extubation with a prediction probability value of more than 0.90.
Modern electroencephalographic parameters, especially Narcotrend, are more reliable indicators for the clinical assessment of anesthetic states than classic parameters.",https://pubmed.ncbi.nlm.nih.gov/14576542/
12818956,ARX-derived auditory evoked potential index and bispectral index during the induction of anesthesia with propofol and remifentanil.,Anesthesia and analgesia,2003,"Schmidt GN, Bischoff P, Standl T, Issleib M, Voigt M, Schulte Am Esch J","A new commercial auditory evoked potential (AEP) monitor (A-line AEP monitor) was developed to calculate an index (ARX AEP index; AAI) by automatically using the amplitudes and latencies of the AEP. We investigated 30 patients before spine surgery. AAI; bispectral index (BIS); relative (%) delta, theta, alpha, and beta; spectral edge frequency; median frequency; mean arterial blood pressure; heart rate; and oxygen saturation were obtained simultaneously during stepwise (1.0 micro g/mL) induction of target-controlled propofol concentration until 5.0 micro g/mL, followed by an infusion of 0.3 micro g. kg(-1). min(-1) of remifentanil. Every minute, the patients were asked to squeeze the observer's hand. Prediction probability (Pk), receiver operating characteristic, and logistic regression were used to calculate the probability to predict the conditions AWAKE, UNCONSCIOUSNESS (first loss of hand squeeze), and steady-state ANESTHESIA (5.0 micro g/mL of propofol and 0.3 micro g. kg(-1). min(-1) of remifentanil). Although a statistically significant difference among the conditions was observed for AAI, BIS, mean arterial blood pressure, median frequency, and %alpha, only AAI and BIS were able to distinguish UNCONSCIOUSNESS versus AWAKE and ANESTHESIA versus AWAKE with better than Pk = 0.90. The modern electroencephalographic variables AAI and BIS were superior to the classic electroencephalographic and hemodynamic variables to distinguish the observed anesthetic conditions.
The modern electroencephalographic ARX-derived auditory evoked potential index and the bispectral index were superior to the classic electroencephalographic and hemodynamic variables for predicting anesthetic conditions. Variables derived from the auditory evoked potential did not provide an advantage over variables derived from spontaneous electroencephalogram.",https://pubmed.ncbi.nlm.nih.gov/12818956/
12707138,Low baseline Bispectral Index of the electroencephalogram in patients with dementia.,Anesthesia and analgesia,2003,"Renna M, Handy J, Shah A","The baseline value of the Bispectral Index (BIS) is 96-99 in the awake state. Patients with Alzheimer's disease or vascular dementia may show an increase in slow wave and a decrease in fast wave activity of the electroencephalogram (EEG). BIS is presumed to decrease with EEG slowing. We hypothesized that the baseline ""awake"" BIS is lower in dementia than in normal elderly patients. We studied 36 patients with Alzheimer's disease or multiinfarct dementia and 36 control patients aged >75 yr. Both groups were assessed with a Mini-Mental State Test. BIS (version 3.4) was recorded from a frontal derivation using an Aspect A-2000 EEG monitor. Off-line data analysis was also performed with the newer version 4.0 of the BIS algorithm. Fourteen of 36 (38%) dementia patients and 4 of 36 (11%) controls had mean baseline BIS 3.4 <93 (P = 0.006). Eighteen of 36 (50%) dementia patients and 8 of 36 (22%) controls had mean BIS 4.0 <93 (P = 0.026). Mean (95% confidence interval) BIS 3.4 was 92.9 (91-95) in the dementia and 96.1 (95-97) in the control group (P = 0.02). Values with BIS 4.0 were, respectively, 89.1 (86-92) and 94.7 (93-96) (P = 0.002). No significant difference was found in age, sex, activity from the electromyogram, and signal quality index. As expected, the difference in Mini-Mental State Test scores was significant (P < 0.0001). A significant proportion of patients with dementia shows a low baseline BIS. The utility of the BIS monitor in detecting dementia warrants further investigation.
This prospective, controlled, observational study demonstrates that electroencephalogram slowing associated with dementia affects the Bispectral Index of the electroencephalogram. A significant proportion of patients with dementia have a lower than normal ""awake"" Bispectral Index.",https://pubmed.ncbi.nlm.nih.gov/12707138/
12606904,"Correlation of approximate entropy, bispectral index, and spectral edge frequency 95 (SEF95) with clinical signs of ""anesthetic depth"" during coadministration of propofol and remifentanil.",Anesthesiology,2003,"Bruhn J, Bouillon TW, Radulescu L, Hoeft A, Bertaccini E, Shafer SL","Several studies relating electroencephalogram parameter values to clinical endpoints using a single (mostly hypnotic) drug at relatively low levels of central nervous system depression (sedation) have been published. However, the usefulness of a parameter derived from the electroencephalogram for clinical anesthesia largely depends on its ability to predict the response to stimuli of different intensity or painfulness under a combination of a hypnotic and an (opioid) analgesic. This study was designed to evaluate the predictive performance of spectral edge frequency 95 (SEF95), BIS, and approximate entropy for the response to increasingly intense stimuli under different concentrations of both propofol and remifentanil in the therapeutic range.
Ten healthy male and ten healthy female volunteers were studied during coadministration of propofol and remifentanil. After having maintained a specific target concentration for 10 min, the depth of sedation-anesthesia was assessed using the responsiveness component of the Observer's Assessment of Alertness/Sedation (OAA/S) rating scale, which was modified by adding insertion of a laryngeal mask and laryngoscopy. The electroencephalogram derived parameters approximate entropy, bispectral index, and SEF95 were recorded just before sedation level was assessed.
The prediction probability values for approximate entropy were slightly, but not significantly, better than those for bispectral index, SEF95, and the combination of drug concentrations. A much lower prediction ability was observed for tolerance of airway manipulation than for hypnotic endpoints.
Approximate entropy revealed informations on hypnotic and analgesic endpoints using coadministration of propofol and remifentanil comparable to bispectral index, SEF95, and the combination of drug concentrations.",https://pubmed.ncbi.nlm.nih.gov/12606904/
12401635,Isoflurane dosage for equivalent intraoperative electroencephalographic suppression in patients with and without epidural blockade.,Anesthesia and analgesia,2002,"Morley AP, Derrick J, Seed PT, Tan PE, Chung DC, Short TG","We conducted a prospective, randomized, controlled trial to establish the effect of epidural blockade on isoflurane requirements for equivalent intraoperative electroencephalographic (EEG) suppression. Fifty patients undergoing abdominal hysterectomy received combined epidural and general anesthesia or general anesthesia alone with isoflurane and alfentanil. Isoflurane was administered by computer-controlled closed-loop feedback to maintain an EEG 95% spectral edge frequency of 17.5 Hz, a target chosen on the basis of a pilot study. In epidural patients, end-tidal isoflurane concentration (FE'(ISO)) was 0.19% smaller (95% confidence interval [CI], -0.32% to -0.06%; P < 0.01), mean arterial blood pressure was 17 mm Hg lower (95% CI, -24 to -9 mm Hg; P < 0.0001), and body temperature was 0.4 degrees C lower (95% CI, -0.7 to 0 degrees C; P < 0.05) than in controls. EEG bispectral index (BIS) was 4 points higher (95% CI, 1 to 7; P < 0.05). EEG median frequency and heart rate were similar in both groups. Epidural patients were 76% more likely (95% CI, 58% to 94%; P < 0.001) to require metaraminol for hypotension and were 28% more likely (95% CI, 3% to 53%; P < 0.05) to require glycopyrrolate for bradycardia. After surgery, the time to eye opening in epidural patients was 2.3 min shorter (95% CI, -4.2 to -0.5 min; P < 0.05). Time to eye opening correlated better with FE'(ISO) in the last 30 s of anesthesia (FE'(ISO) = 0.07 x time to eye opening + 0.31; r(2) = 0.59; P < 0.0001) than with BIS from the same period (BIS = 64 - 1.25 x time to eye opening; r(2) = 0.22; P < 0.001) (P < 0.0001). To maintain similar intraoperative spectral edge frequency, patients receiving combined epidural and general anesthesia require 21% less isoflurane than those receiving general anesthesia alone. This smaller isoflurane dose is associated with faster emergence from anesthesia.
The dose of general anesthetic required to maintain similar intraoperative suppression of brain electrical activity is 21% less in patients with nerve blockade than in those without. This dose reduction results in faster waking times in patients with nerve blockade, which may reflect lighter intraoperative anesthesia. The dose of general anesthetic required to maintain similar intraoperative suppression of brain electrical activity is 21% less in patients with nerve blockade than in those without. This dose reduction results in faster waking times in patients with nerve blockade, which may reflect lighter intraoperative anesthesia.",https://pubmed.ncbi.nlm.nih.gov/12401635/
12401620,"Narcotrend, bispectral index, and classical electroencephalogram variables during emergence from propofol/remifentanil anesthesia.",Anesthesia and analgesia,2002,"Schmidt GN, Bischoff P, Standl T, Voigt M, Papavero L, Schulte am Esch J","The aim of this study was to investigate modern and classical electroencephalographic (EEG) variables in response to remifentanil and propofol infusions. We hypothesized that modern EEG variables may indicate the effects of propofol but not of remifentanil. Twenty-five patients were included in the study after the end of elective spine surgery without any surgical stimulation. Baseline values were defined with remifentanil 0.3 microg. kg(-1). min(-1) and target-controlled infusion of propofol 3.0 microg/mL. EEG changes were evaluated 1, 3, 5, 7, and 9 min after the stop of remifentanil infusion, followed by a step-by-step reduction (0.2 microg/mL) every 3 min of target-controlled infusion propofol. Narcotrend (NT; classifying EEG stages from awake to deep anesthesia), bispectral index (BIS), EEG spectral frequency bands (%), 50% (Median) and 95% percentiles (spectral edge frequency), mean arterial blood pressure, heart rate, and oxygen saturation were detected at every time point. The end of remifentanil application resulted in significant increases in %alpha, spectral edge frequency, mean arterial blood pressure, and %theta and decreases in %delta (P < 0.05). NT, BIS, Median, heart rate, and oxygen saturation were unchanged. Decreases in propofol concentration were associated with statistically significant increases in NT and BIS (P < 0.05). Thus, the sedative-hypnotic component of propofol could be estimated by modern EEG variables (NT and BIS), whereas the analgesic component provided by remifentanil was not indicated. However, during conditions without surgical stimulation, neither NT nor BIS provided an adequate assessment of the depth of anesthesia when a remifentanil infusion was used.
We investigated modern and classical electroencephalographic (EEG) variables during emergence from propofol/remifentanil anesthesia. Modern EEG variables indicate changes of infusion in propofol, but not in remifentanil. Thus, modern EEG variables did not provide an adequate assessment of depth of anesthesia when remifentanil was used.",https://pubmed.ncbi.nlm.nih.gov/12401620/
12032020,Remifentanil dose/electroencephalogram bispectral response during combined propofol/regional anesthesia.,Anesthesia and analgesia,2002,"Koitabashi T, Johansen JW, Sebel PS","The effect of opioid administration on the bispectral index (BIS) during general anesthesia is controversial. Several investigators have reported BIS to be insensitive to opioid addition, whereas others have found a hypnotic response. We designed this study to examine the effect of remifentanil on BIS during combined regional/general propofol anesthesia under steady-state conditions. After Human Investigations Committee approval, 19 healthy ASA physical status I or II patients were enrolled in a prospective experimental design. Regional anesthesia was initiated and general anesthesia induced by using computer-assisted continuous infusion of propofol. Propofol was incrementally adjusted to a BIS of approximately 60. After 20 min at a stable propofol infusion rate, a remifentanil computer-assisted continuous infusion (effect-site target concentration of 0.5, 2.5, and then 10 ng/mL) was sequentially administered at stepped 15-min intervals. BIS decreased from 56 +/- 2 to 44 +/- 1, 95% spectral edge frequency from 17.9 +/- 0.5 Hz to 15.0 +/- 0.4 Hz, heart rate from 84 +/- 5 bpm to 62 +/- 4 bpm, and mean arterial blood pressure from 93 +/- 4 mm Hg to 69 +/- 3 mm Hg with increasing remifentanil concentration. A significant linear correlation between BIS, 95% spectral edge frequency, heart rate, and log (remifentanil effect-site) concentration was found. The change in baseline BIS was relatively modest but significant, suggesting that remifentanil has some sedative/hypnotic properties, or that it potentiates the hypnotic effect of propofol.
This experiment identified a significant, dose-dependent decrease in bispectral index (BIS), 95% spectral edge frequency, heart rate, and mean arterial blood pressure with increasing remifentanil dose. The change in baseline BIS was relatively modest but significant, suggesting that remifentanil has some sedative/hypnotic properties, or that it potentiates the hypnotic effect of propofol.",https://pubmed.ncbi.nlm.nih.gov/12032020/
11879213,Propofol effective concentration 50 and its relationship to bispectral index.,Anaesthesia,2002,"Irwin MG, Hui TW, Milne SE, Kenny GN",Sixty unpremedicated healthy adult patients were studied during induction of anaesthesia with intravenous propofol delivered by a 'Diprifusor' target-controlled infusion. Bispectral index (BIS) and spectral edge frequency (SEF95) were measured concurrently with the predicted blood and effect site propofol concentrations. Logistic regression was used to calculate the predicted propofol blood and effect site concentrations required to produce unconsciousness and no response to a noxious stimulus in 50% and 95% of patients and to correlate BIS with these end-points. The Diprifusor TCI software produces anaesthesia at consistent target concentrations. Bispectral index correlates well with clinical end-points and may be useful during propofol anaesthesia.,https://pubmed.ncbi.nlm.nih.gov/11879213/
11873028,The influence of remifentanil on the dynamic relationship between sevoflurane and surrogate anesthetic effect measures derived from the EEG.,Anesthesiology,2002,"Olofsen E, Sleigh JW, Dahan A","The authors modeled the influence of remifentanil on the dynamics of sevoflurane using three parameters derived from the electroencephalogram: 95% spectral edge frequency (SEF), canonical univariate parameter (CUP), and Bispectral Index (BIS).
Thirty-six patients with American Society of Anesthesiologists physical status class I or II were recruited, of which 12 received a target remifentanil concentration of 0 ng/ml, eight 2 ng/ml, eight 4 ng/ml, and another eight 8 ng/ml. Next (before surgery), several step-wise changes in the end-tidal sevoflurane concentration (F(ET,sevo)) were performed. A data acquisition system simultaneously recorded F(ET,sevo), the raw electroencephalogram, BIS, and SEF. The authors used a combination of an effect compartment and an inhibitory sigmoid E(MAX) model to describe the relation between F(ET,sevo) and BIS, SEF, and CUP. Model parameters (t(1/2)k(e0), E(MAX), E(MIN), C(50), gamma, CUP weight factors) were estimated using the population data analysis program NONMEM. Significant remifentanil model parameter dependencies (P < 0.01) were determined.
Determined from SEF, remifentanil had no effect on t(1/2)k(e0) (1.91 +/- 0.26 min [mean +/- standard error]) but caused an increase in C(50) (baseline = 1.48 +/- 0.12%; 80% increase at 8 ng/ml) and decrease in E(MIN) (baseline = 10.8 +/- 0.6 Hz; 80% reduction at 8 ng/ml). Determined from CUP, remifentanil caused a dose-dependent decrease in t(1/2)k(e0) (baseline = 4.31 +/- 1.00 min; 60% decrease at 8 ng/ml), with no effect on C(50) (baseline = 0.88 +/- 0.13%). Determined from BIS, remifentanil caused a dose-dependent decrease in t(1/2)k(e0) (baseline value = 3.11 +/- 0.32 min; 40% decrease at 8 ng/ml), without affecting C(50) (baseline = 1.12 +/- 0.05%). Median R(2) values of the pooled data set were 0.815 for SEF, 0.933 for CUP (P < 0.01 vs. SEF), and 0.952 for BIS (P < 0.01 vs. SEF and CUP). Addition of remifentanil increased the R(2) values for CUP only.
Remifentanil accelerates sevoflurane blood-brain equilibration without affecting its hypnotic potency as determined from BIS and CUP. In terms of R(2), the authors' pharmacodynamic model describes the anesthetic-BIS relation best.",https://pubmed.ncbi.nlm.nih.gov/11873028/
